{"baselineCommit":"f8acb7fbbfef0c681affb74e08336ec8bc72bca0","declaredFileCount":554,"declaredFindingCount":393,"declaredFingerprintCount":328,"declaredRuleCount":68,"detectorCoverageSummary":{"declared":14,"executed":12,"humanOnly":1,"schemaOnly":1,"sourceCapable":12},"entries":[{"count":1,"detectorId":"LayoutScrollScanner","fingerprint":"sha256:b30d6b2c245ed92beeee7daa8d28e2e71f4a85bcbf1bb7dc4cb12ddec48a9dcb","locations":[{"column":3,"endColumn":9,"endLine":4,"line":2}],"normalizedEvidence":{"kind":"view-root-structure","predicate":"view-root-surface-forbidden","related":[],"subject":"div","value":null},"ownerKey":"file:apps/desktop/src/App.vue","path":"apps/desktop/src/App.vue","ruleId":"CCD-UI-029"},{"count":1,"detectorId":"LayoutScrollScanner","fingerprint":"sha256:34384c1904e77a0e7e3374875f1524db990f61419da471cfef4081b0c0a8b121","locations":[{"column":3,"endColumn":9,"endLine":4,"line":2}],"normalizedEvidence":{"kind":"view-root-structure","predicate":"material-on-view-root","related":[],"subject":"div","value":null},"ownerKey":"file:apps/desktop/src/App.vue","path":"apps/desktop/src/App.vue","ruleId":"CCD-UI-030"},{"count":1,"detectorId":"TokenLiteralScanner","fingerprint":"sha256:6fc9842a4535fa33ed09d9a710e14a90fcd88399bcc8a4a8e797f16dac705504","locations":[{"column":36,"endColumn":46,"endLine":68,"line":68}],"normalizedEvidence":{"kind":"token-literal","predicate":"rem-em-literal-forbidden","related":[],"subject":"0.375rem","value":"0.375rem"},"ownerKey":"file:apps/desktop/src/main.ts","path":"apps/desktop/src/main.ts","ruleId":"CCD-UI-012"},{"count":1,"detectorId":"TokenLiteralScanner","fingerprint":"sha256:0c02d519d0774665e9999ff4c83d388bf3243708a12ee6d0ea9676f6b5698dcb","locations":[{"column":31,"endColumn":46,"endLine":67,"line":67}],"normalizedEvidence":{"kind":"token-literal","predicate":"rem-em-literal-forbidden","related":[],"subject":"0.5rem 1.5rem","value":"0.5rem 1.5rem"},"ownerKey":"file:apps/desktop/src/main.ts","path":"apps/desktop/src/main.ts","ruleId":"CCD-UI-012"},{"count":1,"detectorId":"TokenLiteralScanner","fingerprint":"sha256:0ec77237ed2fb258de993410e886c95f0dd9f1f92f821b58ca69fde00d2f6de8","locations":[{"column":30,"endColumn":38,"endLine":56,"line":56}],"normalizedEvidence":{"kind":"token-literal","predicate":"rem-em-literal-forbidden","related":[],"subject":"0.5rem","value":"0.5rem"},"ownerKey":"file:apps/desktop/src/main.ts","path":"apps/desktop/src/main.ts","ruleId":"CCD-UI-012"},{"count":1,"detectorId":"TokenLiteralScanner","fingerprint":"sha256:d78ac347fc41be5e672476b3fa25ecd0fefc685cc1c1a43ef337158cf06241e6","locations":[{"column":27,"endColumn":37,"endLine":60,"line":60}],"normalizedEvidence":{"kind":"token-literal","predicate":"rem-em-literal-forbidden","related":[],"subject":"0.875rem","value":"0.875rem"},"ownerKey":"file:apps/desktop/src/main.ts","path":"apps/desktop/src/main.ts","ruleId":"CCD-UI-012"},{"count":1,"detectorId":"TokenLiteralScanner","fingerprint":"sha256:3b57fd88729ca0536ccda88de3d7de2b0f97bd7ba84b33b3708e2b1a0ad2e907","locations":[{"column":26,"endColumn":36,"endLine":55,"line":55}],"normalizedEvidence":{"kind":"token-literal","predicate":"rem-em-literal-forbidden","related":[],"subject":"1.125rem","value":"1.125rem"},"ownerKey":"file:apps/desktop/src/main.ts","path":"apps/desktop/src/main.ts","ruleId":"CCD-UI-012"},{"count":1,"detectorId":"TokenLiteralScanner","fingerprint":"sha256:345f5648669c27666791dffeec7b43f6e792dbe75a7901e350215ea51532b791","locations":[{"column":33,"endColumn":39,"endLine":66,"line":66}],"normalizedEvidence":{"kind":"token-literal","predicate":"rem-em-literal-forbidden","related":[],"subject":"1rem","value":"1rem"},"ownerKey":"file:apps/desktop/src/main.ts","path":"apps/desktop/src/main.ts","ruleId":"CCD-UI-012"},{"count":1,"detectorId":"TokenLiteralScanner","fingerprint":"sha256:55885682f8be04ece77401d4006113d06f9cb9ff72b8c3f6d26cee506fbd625e","locations":[{"column":29,"endColumn":35,"endLine":52,"line":52}],"normalizedEvidence":{"kind":"token-literal","predicate":"rem-em-literal-forbidden","related":[],"subject":"2rem","value":"2rem"},"ownerKey":"file:apps/desktop/src/main.ts","path":"apps/desktop/src/main.ts","ruleId":"CCD-UI-012"},{"count":1,"detectorId":"TokenLiteralScanner","fingerprint":"sha256:ac2effda9711254c998c1135f7b1cbd6a82495a6f5e99f7e0b8602bd1bdf69fc","locations":[{"column":36,"endColumn":46,"endLine":68,"line":68}],"normalizedEvidence":{"kind":"token-literal","predicate":"visual-literal-forbidden","related":[],"subject":"0.375rem","value":"0.375rem"},"ownerKey":"file:apps/desktop/src/main.ts","path":"apps/desktop/src/main.ts","ruleId":"CCD-UI-015"},{"count":1,"detectorId":"TokenLiteralScanner","fingerprint":"sha256:f7d4d1371b15846f9725c50990262c02d20d38a51783a5caad55970dc4b89ef3","locations":[{"column":31,"endColumn":46,"endLine":67,"line":67}],"normalizedEvidence":{"kind":"token-literal","predicate":"visual-literal-forbidden","related":[],"subject":"0.5rem 1.5rem","value":"0.5rem 1.5rem"},"ownerKey":"file:apps/desktop/src/main.ts","path":"apps/desktop/src/main.ts","ruleId":"CCD-UI-015"},{"count":1,"detectorId":"TokenLiteralScanner","fingerprint":"sha256:6db1b059fdda01fac74e757b26d8ac6b25e4d3dce026f633b633197beb1d029f","locations":[{"column":30,"endColumn":38,"endLine":56,"line":56}],"normalizedEvidence":{"kind":"token-literal","predicate":"visual-literal-forbidden","related":[],"subject":"0.5rem","value":"0.5rem"},"ownerKey":"file:apps/desktop/src/main.ts","path":"apps/desktop/src/main.ts","ruleId":"CCD-UI-015"},{"count":1,"detectorId":"TokenLiteralScanner","fingerprint":"sha256:b2e401c00bd5ae5aceb0d3edc5b2c4050f62fcad04ad13da8c6ae43ab5144272","locations":[{"column":27,"endColumn":37,"endLine":60,"line":60}],"normalizedEvidence":{"kind":"token-literal","predicate":"visual-literal-forbidden","related":[],"subject":"0.875rem","value":"0.875rem"},"ownerKey":"file:apps/desktop/src/main.ts","path":"apps/desktop/src/main.ts","ruleId":"CCD-UI-015"},{"count":1,"detectorId":"TokenLiteralScanner","fingerprint":"sha256:a796e5f518b78958a04a3de477e11fe9580917368d1a81ebbb3b2aa9c2a1e0fd","locations":[{"column":26,"endColumn":36,"endLine":55,"line":55}],"normalizedEvidence":{"kind":"token-literal","predicate":"visual-literal-forbidden","related":[],"subject":"1.125rem","value":"1.125rem"},"ownerKey":"file:apps/desktop/src/main.ts","path":"apps/desktop/src/main.ts","ruleId":"CCD-UI-015"},{"count":1,"detectorId":"TokenLiteralScanner","fingerprint":"sha256:df33e3a12852bdf1c2e340cac7410770796a677032b605a4866cd975038ec864","locations":[{"column":33,"endColumn":39,"endLine":66,"line":66}],"normalizedEvidence":{"kind":"token-literal","predicate":"visual-literal-forbidden","related":[],"subject":"1rem","value":"1rem"},"ownerKey":"file:apps/desktop/src/main.ts","path":"apps/desktop/src/main.ts","ruleId":"CCD-UI-015"},{"count":1,"detectorId":"TokenLiteralScanner","fingerprint":"sha256:d5fa938328860c2e667b72ea6db29304bf7d983c699d101514de2fb457d71b05","locations":[{"column":29,"endColumn":35,"endLine":52,"line":52}],"normalizedEvidence":{"kind":"token-literal","predicate":"visual-literal-forbidden","related":[],"subject":"2rem","value":"2rem"},"ownerKey":"file:apps/desktop/src/main.ts","path":"apps/desktop/src/main.ts","ruleId":"CCD-UI-015"},{"count":1,"detectorId":"TokenLiteralScanner","fingerprint":"sha256:01f753ee00817f40f1f04d40f9be549226de3808dbdb0a39ee4fcc181d6b1925","locations":[{"column":5,"endColumn":15,"endLine":48,"line":27}],"normalizedEvidence":{"kind":"dimension-declaration","predicate":"dimension-token-required","related":[],"subject":"max-w-[720px]","value":"max-w-[720px]"},"ownerKey":"file:apps/desktop/src/views/DesktopHome.vue","path":"apps/desktop/src/views/DesktopHome.vue","ruleId":"CCD-UI-016"},{"count":1,"detectorId":"LayoutScrollScanner","fingerprint":"sha256:cd0a0e57cfdc8dfc52359c55d8b1846cf963800df03b165d66853fd99a93fcb1","locations":[{"column":3,"endColumn":10,"endLine":49,"line":23}],"normalizedEvidence":{"kind":"view-root-structure","predicate":"view-root-surface-forbidden","related":[],"subject":"main","value":null},"ownerKey":"file:apps/desktop/src/views/DesktopHome.vue","path":"apps/desktop/src/views/DesktopHome.vue","ruleId":"CCD-UI-029"},{"count":1,"detectorId":"LayoutScrollScanner","fingerprint":"sha256:0e0c09bc0a2482a5da982721d4af7d3cd629de12c03f9c6ef056c42f3ce558a6","locations":[{"column":3,"endColumn":10,"endLine":49,"line":23}],"normalizedEvidence":{"kind":"view-root-structure","predicate":"material-on-view-root","related":[],"subject":"main","value":null},"ownerKey":"file:apps/desktop/src/views/DesktopHome.vue","path":"apps/desktop/src/views/DesktopHome.vue","ruleId":"CCD-UI-030"},{"count":1,"detectorId":"EchartsOwnershipScanner","fingerprint":"sha256:9fbd79efb4f1029f685dccc05ed80d7ebbc6bd24c3c833438828f918c32fadd6","locations":[{"column":1,"endColumn":45,"endLine":11,"line":11}],"normalizedEvidence":{"kind":"runtime-api-reference","predicate":"chart-runtime-owner-required","related":[],"subject":"echarts","value":null},"ownerKey":"file:apps/web-demo/src/adapters/charts/UseEcharts.vue","path":"apps/web-demo/src/adapters/charts/UseEcharts.vue","ruleId":"CCD-UI-005"},{"count":1,"detectorId":"TokenLiteralScanner","fingerprint":"sha256:fb5b9d099ac1d08b87559dd5f4c94c1d147accbbcbd04c25966e6d3a9bceb3cc","locations":[{"column":5,"endColumn":1,"endLine":31,"line":30}],"normalizedEvidence":{"kind":"dimension-declaration","predicate":"dimension-token-required","related":[],"subject":"transform:translate3d(-34px, 18px, 0) scale(0.98)","value":"transform:translate3d(-34px, 18px, 0) scale(0.98)"},"ownerKey":"file:apps/web-demo/src/assets/styles/ambient-orb-animations.scss","path":"apps/web-demo/src/assets/styles/ambient-orb-animations.scss","ruleId":"CCD-UI-016"},{"count":1,"detectorId":"TokenLiteralScanner","fingerprint":"sha256:3f242356c7a9f5d78bf691e2ca11617df66ca8e80c12dec562d9597b22cc7b4a","locations":[{"column":5,"endColumn":1,"endLine":35,"line":34}],"normalizedEvidence":{"kind":"dimension-declaration","pr